User Name,Rating,Content,Date
NO ONE,4,"""WhatsApp is a convenient and user-friendly messaging app. It's free, reliable, and offers end-to-end encryption for secure conversations. The app is feature-rich, with options like group chats, voice and video calls, and file sharing. However, it can be slow at times and lacks some advanced features. Overall, it's a great choice for personal and professional communication.""",2025-03-11 16:13:26
Husna Mariah Humeirok,4,I love WhatsApp's new feature (music in the status section) but I asked to provide all the music and the entire artist. I couldn't find my favorite song there.,2025-03-12 16:06:05
Nethu Vishu,3,"I am currently satisfied with the features provided by WhatsApp. However, I would be much happier if features such as transparent bubble styles, emoji-type downloads, and the ability to set wallpapers on the home page, which are available in unofficial versions of WhatsApp, could be made available in the official WhatsApp as well.",2025-03-09 05:36:00
Abrar Hameem,3,"Hey WhatsApp team, You see I'm in a kind of a situation,my recent old Google account is lost cause I forgot the password of it, and all my important messages were backed up on that account,I was hoping if you'd be able to recover those messages from that lost account and do me a favour,I have access to the WhatsApp number but not that Google account so I cannot backup them, I hope you'll give me a solution for this, thank you.",2025-03-23 10:37:30
† Des Clowniac.†,1,"Please undo the update you did to share photos from gallery, it sucks, it doesn't show all archives/albums. You have to open camera, enter on the pic icon to just be able to see all of your albums and select a pic, otherway, if you open the normal pic icon that appears when you touch the ""clip"" icon, it shows less albums, and by defect, you have to search manually the image you're looking for, also, this update looks awful :( please undo it to the old one and keep it that way.",2025-01-01 00:54:23
Grasy MAGAL,1,"Hello WhatsApp Equipe, I hope you've been enjoying this New year. I've been experiencing a really bad background during my videos calls on here. I did activate the background one time, but it doesn't come out even though it's showing me there isn't a background. I hope you'll be able to help me to take that weird background from my video calls. Thank you so much in advance. Have a blessed day.",2025-01-07 11:04:15
Hrishik Mehta,1,"I absolutely hate the ""View Once"" picture feature on WhatsApp it’s frustrating, unnecessary, and makes communication more complicated. Sometimes I need to revisit a picture but this feature deletes it after one view which is extremely inconvenient. If someone accidentally opens a photo at the wrong time they lose access forever.Please remove this feature.",2025-02-12 03:51:57
Onkel Bo,2,"Since the last update I can't correct written words anymore. It always selects the whole word but doesn't show any option (like copy, select all,...). Because of this I'm not able to go in between words to correct single mistyped letters or insert a word to a sentence without replacing/re-writing the previous word in the message. Now I have to write my messages in a text editor to then copy them to WA and thats really not nice.",2025-01-14 11:25:13
Suhaib Nadeem,1,"For me the most imp thing is to send my videos and pics to someone and in that process the QUALITY of those decreases badly, i can't able to send my adorable pics and videos in the same original hd quality like seriously, the most popular and the most used app in the whole world doesn't have access and control to send those items at the same quality 😏🙃",2025-02-17 18:12:32
Light Austin,4,"nice app.... although I preferred having my status arranged the way it was before, the channel update isn't really necessary from my point of view as people mostly use WhatsApp to communicate and chat...meanwhile u can't even type a comment or something in the channels only ""reactions"" which is sometimes boring",2025-03-22 22:26:58
Sweet Tooth 77,3,15 07 24 Add 'DELETE FOR THEM'. Ur using G drv for chat backups so we are exportg chats to survive. We could send the convo to THEM offline then DELETE FOR THEM keeping it on our side for flow if we change devices eg when they are misbehaving & need to be checked. Plus chat backups just rotates & rotates. Unreliable! Yet SUPER KEY!,2025-02-08 08:22:22
Saravanakumar Sathasivam,4,"There is a bug in status menu. When we are watching a status video, if we get back, it still plays even we reach home screen. It only stops when we clear our recent apps. Until another statuses are playing continuously.. I don't know, if I conveyed it correctly or not. But this was the issue I had facing for a while. If developer sees this comment. Pls fix this in next update. Thanks !",2025-01-25 15:08:05
Ahmed Chacings,1,"The disappearing message menu is very dangerous because you can lose important message without notice even though you don't activate disappearing message, because if the other people that chat you activate it your chat history is also removed.",2025-03-20 07:28:58
Hanan Shafik Ahmad,5,I love the app but for some reasons recently whenever I opened the app all my contacts are unsaved they all changed into numbers unless I have to add them again but everytime I do it unsaved again some says it needs an update but I've already updated it but still so now all my contacts are unsaved this is very bad I hope it can be fixed immediately or if there is another way to solve the issue let me know because if it continues I might delete the app,2025-03-02 23:34:20
Anita Suryawanshi,3,"Help me whatsapp team,I don't know how but someone is spamming my account and changing my profile photo into some random girl's pictures it is the second time I have to delete and download whatsapp again. Some unknown international numbers are sending some weird text like ' ? ' which was sent to me by an unknown Saudi Arabian number. I wish my problem will soon get solved.",2025-03-19 07:28:29
Cortez DeCales,3,"It should be more privacy. it has access to all phone's info from pics to hardrive otherwise doesn't work correctly? Right, I am not comfortable with everyone else inviting me to join communities. This is not Instagram! I think the app had a good start with the status setting but again this is not Facebook! Why this app is becoming part of a daily productivity when there are others Skype. Viper, and Meet should be the priority in Android like FaceTime in iPhones. Be careful with this!",2025-02-26 15:57:50
Leighanne Redman,1,"Since the new update 28/02 my WhatsApp isn't working at all. Nothing loads or sends, and all my blocked contacts are now unblocked and it won't let me change it. In fact, it won't allow me to change anything. Done the obligatory delete then reinstall and nothing works. Tried both on mobile data and WiFi.",2025-02-28 16:59:24
محبة الأقصى,1,"1. Very slow. 2. Takes large space, min. 2.5GB, though clear all chats, no media downloaded,& earising all bkups! 3. Searching is pain, either for messages or for contacts. 4. Fowarding is impossible mission, due to searching failure. 5. Recieving messages takes a lot of time, may be 20 min. or more. 6. Lacks many features, e.g. pin more msgs, highlight personal chats, sorting chats into folders. 7. Calling not working usually. 8. Allways crash&lose written. A lot of other issues, recode it plz.",2025-02-08 11:17:32
Silver Wings,5,"Well, all i can say is the app works perfectly as intended. It's still the best messaging app until now with how useful and simple it is. But... 😅 there is one problem that i have is that when you go to a group's media links and docs section there is a single problem which is you can't search for the files you want without the app crashing :/ this problem has been there for a while now and i'd love if it gets fixed as it helps people look for what they want quicker. Thank you!",2025-01-04 20:51:16
Akinola Saheed,2,"I can no longer edit previously sent messages... This is not just bad, it is very bad. How can a social media app not have an edit option for previous comments? WhatsApp did this one wrong!",2025-03-15 22:57:12
Apurva Tewari,3,It was better earlier. Easier to use. Now they've made it more complicated and it's not different from any other app. I'm unhappy about some things like if I've muted a group then why are the voice chats not muted and i keep getting notifications about them.,2025-02-27 14:32:16
Joshua Nwokeocha,3,"The new ""music added to picture update"" has a problem..because any time i choose the song i want, to a pic and post on my status, the song does not play. Pls fix the prob.",2025-03-17 06:46:35
Josephine Cheung,1,"not able to transfer chat from iPhone to Android. it get stuck in initializing and then time out with unable to connect. I am so frustrated to the point that I am okay without the chat history, but it won't even load.",2025-03-24 14:19:54
Qasim Ali,5,"""Hello WhatsApp Team, I love using WhatsApp and enjoy all its features! However, I'm facing an issue with setting up two-step verification. Despite multiple attempts, I keep getting the error message ""You cannot set up two-step verification. Try again after a few hours."" This issue has been persisting for several days. I would appreciate it if you could look into this matter and provide a solution.",2025-02-26 08:57:38
Mike M. Gikunda,2,"⭐⭐ Annoying Mentions in Status – Needs Fixing! WhatsApp’s new mention feature in status is frustrating! Anyone in a group can tag me, even if I don’t know them, and there’s no way to stop it without leaving the group. This is a privacy issue. WhatsApp should add a setting to restrict who can mention you in their status, just like with calls and groups. There should also be an option to approve mentions or turn them off completely. This feature needs better controls ASAP!",2025-03-13 10:33:23
Mc Lalropeki,5,"Can you make a timer to send message to a specific time and date like we have in the calender. Sometime we need to remind someone something again but can forgotten when time comes. I guess this will be good update in the future. New message: Guess what, this feature i say above is already developed by instagram hehe",2025-03-10 19:56:47
Bower Odendaal,1,"I've never had these problems and yet I have contacted you several times since it started about my location sharing and downloading problem but you fail to resolve the issue. Keep on telling me to do this or that, go here or there. This sucks.",2025-03-02 06:55:06
mitchell muthee,2,"kindly may I know what is happening to my WhatsApp/number I have been burned from using WhatsApp reason I don't know why for almost 4 months now, you keep on telling me to download the original WhatsApp yet av been using it. kindly fix it asap my business is now stagnant. thank you.",2025-03-28 21:05:51
Moradeyo Alaba,5,I can only said I enjoying the whatsapp message requests as it's give collective insight allover. I so mush appreciate it also allows families for easy contact and familiarity together easylilly. Thank you and God Blessed. As for me i don't have any optional to give apart to let you know that this apps give so much in joining people's to get hin touched each other's. Thank you may God grant you more Knowledge.,2025-03-20 22:20:35
MARIO CHHANGTE,4,"Latest update is awesome but when we add music, photos and videos were blur. If you can fix this it will be perfect.🫡 😇 P.O.V. If peace, thumbs up and heart🩷 effect also be included in android. ✌️",2025-03-25 19:14:28
Arslan Raja,3,"Subject: Unable to Sync Messages After Accidental Logout Dear WhatsApp Support Team, I'm writing to request assistance with syncing my WhatsApp messages. On January 29, 2025, my linked device accidentally logged out of WhatsApp, and I had to log back in. However, despite waiting for over 9 days, my messages have not synced, and I'm still seeing the ""Syncing older messages, this may take a while"" message. I've tried restarting the app and checking my internet connection .",2025-02-04 10:19:47
Angela Jairyll De Jesus,2,"lates update was interesting, to say the least. the 'undo' and 'redo' buttons in the editing pictures/video menu is completely gone...",2025-03-23 11:39:18
Chiadikaobi Victor,5,"Very good app best in terms of fast , reliable and far communications in cheapper rate But having a serious problem now images received from someone's chat does not automatically save to my gallery. I have set it to be downloading automatically and saving to my gallery but to no avail 😭😭. It's really giving me concern now",2025-02-08 16:37:38
Rahul Kunche,1,Removing an essential feature that nobody had any problem with is so asinine I can't believe the decision makers took this call. Millions of users hated this change yet you guys do not care. When I go to gallery to share media I SHOULD BE ABLE TO VIEW ALL BLOODY FOLDERS. Why are you making this so difficult!? Now I have to change apps altogether to choose pictures or videos in other folders on my device making it PAINFULLY TIME CONSUMING and also RISKING SENDING TO WRONG RECIPIENTS 😡😠😡,2025-02-17 15:24:40
A Google user,4,Great app for communicating with friends and family. The new look of the app is awful. Please move the Navigation Bar on the Home Screen back at the top of each screen in green background as it is easier to look at. There is too much glarey white which hurts my eyes and makes the pages difficult to look at. Please remove Channels. Please stop forcing too many unnecessary mandatory updates to this app. Please change this app back to the old original look.,2025-01-29 00:52:53
tony feghaly,4,"When I change between light green theme and the darker green, the colours of the conversion are still the same (on the light green). Plus, the blue ticks don't appear on other themes (except the original one). I hope to fix these issues.",2025-02-25 21:34:04
Harsh Bharadwaj,4,"The new ui is good for single hand use but for searching a chat we have to scroll all the way to top of chats page and click the search bar. I believe a search icon either on the top on chats page (just like updates, calls) or a common one in the bottom will be easier to use.",2025-02-26 04:37:30
M.Daoud Khan,3,"A Suggestion for Improvement! I'd like to suggest that WhatsApp remove or relocate the ""+"" icon that appears during calls. It's too easy to accidentally tap and add unwanted participants to the call. Moving or removing this feature would give users more control and eliminate the problem of people joining calls unintentionally. I hope the WhatsApp team considers this suggestion and continues to improve the app!",2025-01-29 17:52:04
Farhad Arora (Ferrari),1,"Whatsapp has become more of an unreliable pain. Filled with issues bugs and over complicated nonuser friendly security compatibility problems. Chances are if you are upgrading from and old phone, whatsapp wouldn't sync old data effectively. Certainly about time for new platforms to takeover as more reliable chat data storage options. Use Whatsapp only if you are fine loosing your old chat data.",2025-02-27 07:11:33
Sonya Kass,1,"Awful. Woke up one day to find all my chat history,media and memories that ill never recover,which were set to back up daily and were synced, to all be wiped out by whatsapp for no reason. Even after reinstalling nothing was restored. I'm just heart broken. Worse part, help centre is a fraud. They can't or won't help . Won't explain or help you to recover your data .",2025-02-27 01:06:01
shiva kumar,1,Horrible app made me lose my backup twice as I tried to uninstall and reinstall as it's not letting me link any devices for web login. It didn't even ask me for any backup option while signing in after reinstalling. Pathetic experience. Looks like no one cares. Going on Whatsapp help is of no use. No one has reached out even after 2 months.,2025-02-12 07:17:31
Fawad Khan,3,"Unfortunately, WhatsApp doesn't have an option to prevent the video camera from turning off during a video call when a new message is received. This behavior is consistent across both Android and iOS platforms. If you'd like to suggest this feature to WhatsApp, you can provide feedback through the app's settings.""",2025-02-24 17:52:46
Mayank Shekhar,1,"Very poor overall UX when it comes to migrating chats from old to new device. The issue that I'm facing is that old device shows chats transferred successfully and logs me out and new device shows transfer failed so I'm stuck in-between with no option but to re-login in my old device again to recover my chats. And while logging in as well there's a lot of hassle related to OTPs, might be for security reasons but I'm sure they can implement a better way for users to migrate.",2025-02-27 08:11:05
J,5,Swipe up to talk live in groups - I think this feature should be like if we had 4 persons to a group and 2 persons joined the swipe up to talk live feature. It should be like a recorded voicenote between the two persons who holds a conversation and when the other people in the group see the it they can listen to the recording and get up to speed. Would be a great feature.,2025-02-20 13:57:07
green player,3,I cant give whatsapp 5 or even 4 stars. Its an incredible app but the proximity sensor after a whatsapp update now keeps messing me up. I would often cover the screen while the voice message plays since they could be over 5 min long. Now even a slight touch to the proxy sensor then the volume of whatsapp voice recordings goes down. Not even the Messenger app in phone does that. Yet whatsapp an installed app does that. If there was a setting for proximity sensor then whatsapp would be perfect.,2025-01-26 18:32:58
Shivani Sharma,1,"this app has become pathetic now, these new updates are disappointing. And leave new updates, I'm not able to download HD videos from channels and when sometimes in chats . This is really dissatisfactory, as I've joined some crucial channels where every stuff is crucial for me ..I've my app all updated my device is all updated but still I face this issue , it bothers a lot to be very honest",2025-02-14 20:15:17
Jahnavi Ballani,1,"I am extremely disappointed with the recent issues on WhatsApp. First, there are no updates or improvements to address ongoing problems. Second, the quality of photos when I upload them to my status is terrible—they become so blurry that they’re barely visible. This is very frustrating and affects the overall user experience. I hope WhatsApp resolves these issues as soon as possible!",2025-01-27 13:08:09
Jayant D. Kulkarni,1,Not flexible for cloned apps.. Missing many basic things. Not easy to transfer chat from one phone to another more than once. Many Many flaws in the app.. Unfortunately most of the people are using it hence else eager to leave WhatsApp and move to telegram or signal. Arrogant customer care is cherry on the top.. Waiting for people to understand beauty of other messaging apps.,2025-02-21 03:38:03
sam london,1,"Latest UpDate on iPhone , unable to zoom in on a photo received with other photos , when you recieve multiple photos at once from a sender, you tap one photo of them and try to zoom in as you was able to do in the previous version but you can't do it in this update, also the photos does not appear in the media section .",2025-01-26 13:22:44
Mohammad Shahnawazul Haque,5,"WhatsApp indeed functions as a 4-in-1 app with these features: 1. Messenger & Video Calling – Instant messaging, voice/video calls, group chats. 2. Notes – Using Saved Messages (Message Yourself) to jot down quick notes. 3. Reminder – Users can send messages to themselves as reminders or use third-party integrations like Google Assistant or Siri. 4. Ledger Book – WhatsApp Business allows transaction tracking, but it's not a full-fledged ledger; however, users can manually note expenses.",2025-02-25 21:46:14
ashwani binjola,4,Latest update on WhatsApp is good but there is one issue I am facing very badly . I lost the chat which I had sent to my own no. In WhatsApp. I kept my own no. in archive chat to save important data for future use but now I couldn't able to find the archive chat in both the conditions when the toggle of archive chat is ON/OFF. Please resolve the issue so that I can get to see my saved data soon.,2025-02-02 20:13:22
Obed Tumain,5,This app is good and all but I think it would be more convenient and user friendly and more comfortable to the user if you would create a setting that allows you to customize your background. I'm not saying in the chants but in the list of chats itself. I honestly think that would make me like Whatsapp that much more. So please include 5hst in your next update,2025-01-30 17:46:19
Datu Siraj,5,"Hey soo... I really like the music feature on status but some of yhe songs i like isn't there so i really would like it if you add more ""tiktok trending songs"" and more kpop group songs like 'Kiss of life' or 'Nastyona' and i also kinda want the text feature in status to have more features to it such as backgroup music or something that really makes it different. Thanks and i hope you take heavily on my review. [heart]",2025-01-29 09:12:07
Usman 'Uzzi' Khokhar,1,"The old format of ""is typing"" was what made Whatsapp better, more accessible and sincere, then the vague three dots. Terrible design choice. UI is getting really unusable for the visually impaired and sensitive users. The attachment UI is a horrid disaster and rendering the app difficult to use.",2025-02-08 20:07:55
Eli Lebow,4,"Fixed! Old 2 star review: I'm very sensitive to animations, and the new always on animation on the list of chats screen has made WhatsApp go from a basically pleasant experience to a basically unpleasant one. I searched for a way to turn it off and did not find one.",2025-02-03 18:50:12
Mr DWJJ 'Ige-Rahman',2,"I find nothing whatsoever to be simple &straight forward on this app, it wont transfer to a new phone in its previous entirety like ALL other apps do with all its contacts and chats along with it. I find it an over complicated yet necessary nightmare.and what for heaven sake is a beta programme? Amongst many other such terms and functions that some of us who are not ""whizz kids"" have no idea about whatsoever?",2025-01-29 05:22:50
Casie Fidel,5,I love the latest update where I have to change the chat theme. But it would better the experience if I would be able to customize the theme to what my preference would be like having a blue chat theme and also the other things in the app like the status rings and dots changing to the same color as my chat theme to give it a better and more comfortable outlook...thank you for your great work Meta 💯,2025-02-17 14:25:47
Malaika Shams,4,"It's definitely the best app it makes everything so easy we can connect to our love one's with much ease but there is a suggestion i think u should shift the setting button in the bottom like for chats, status and others and it should be added separately so that there is more ease for the people who don't know how to use it.. However it's the best app ever",2025-02-21 11:42:09
Garrett,4,"it used to work perfect but now the camera only works when it wants to, it is always dimmed for some reason and sometimes its just pitch blak and when i try to take a photo/video it just says ""photo capture failed"" or ""video capture failed"" i have missed so many photo opportunities because of this. please fix",2025-01-29 21:32:16
Divya,1,"Worst update ..can't forward multiple stickers ..when long pressed one sticker gets selected for reaction or forward but when want to select another the other stickers don't get selected but showing only add to favorites kinda one tap options..do, do we only get to forward one sticker at a time ..don't update apps if you're only making it worse..also have options for uninstalling updates ..stupid app",2025-02-20 18:49:41
Riki Le,2,"Whatsapp was fine for years, no idea what happened lately but contacts just stopped saving from within the app, or syncing from contacts. All the permissions and settings seemed fine, I didn't change a thing. Update did not help either, I hope it didn't ruin anything more.",2025-02-05 10:49:30
Lebohang Makubo,3,What's the problem with WhatsApp trying to fix things that aren't broken. Not only does it not show all my photos but it forces me to use Google photos. What was so wrong with letting me choose photos using an app of my choice. And now I have to leave the app if I'm looking for a photo that's in a directory WhatsApp can't suddenly find.,2025-02-09 11:25:50
Shivam Chauhan,1,"My whole 5 to 6 years of data is now stuck because of your buggy restoration and chat transfer. And to add to that, you do not allow clearing data and allowing restore. Moreover, you have such a bad mechanism for verification in the name of security that you don't allow re-verification multiple time because in hopes of trying to restore whatsapp data i have to reinstall and uninstall again and again. Never recommending whatsapp to anyone if they want a smooth messenger experience.",2025-02-11 08:42:33
Peter Austin,1,This app has too many bugs. Please fix. My account was blocked for almost 7 times now and after 1 day they unblock my account. I want to know the reason for blocking my account and how to get my data backup as I am unable to log in to my account using my phone number. I keep getting errors. I am trying since 2 days to login. I have deleted my data of 9 GB but still I am unable to login. I have emailed many times but no response.,2025-02-02 12:12:58
