User Name,Rating,Content,Date
Sibonelo Siphesihle,4,"The new version is dope, but the only problem is whenever I call a specific person it only says ""connecting"" but when I call other contacts It connects very well. I don't know what's happening but please fix this problem asap!",2025-03-14 20:27:57
Mubasher Bilal,5,It helps all the people for call message video files audio photo everything. It is very important and secured. It is also very easy to use. It also provides an important service of video and Voice call online. It also provides voice chat.,2025-03-30 03:36:26
Sneha Birdika,1,"The backup system is pathetic. It feels more like a stolen vault than really a backup recovery. I lost my data thrice in the last couple of years. I completely fail to understand the thought of why will they create a system that cannot be recovered? Second, recently I started receiving popup msgs saying ""checking new messages"" onky to realise it is a message on the muted or archived chats. The whole reason i muted it was to NOT receive a notification about it. Whatsapp needs improvements.",2025-01-31 18:58:07
Eboda Abimbola,3,"Can you please add an option to ""select all"" media (photos, videos etc) for deletion in group chats. I want to delete over 2000 photos from a group chat on my phone and I'm told to select them one by one instead of selecting all to delete at once. Please add this feature as i want to clear my phone of numerous unwanted photos",2025-03-17 10:38:41
Aniket Biswas,1,"Dear WhatsApp On devices that are a little older, WhatsApp is facing a lot of problems. The WhatsApp DP is not displayed as it should be and the WhatsApp app is taking a long time to open.I use WhatsApp but I am not happy. I have expressed my opinion many times but no one is giving priority to the house. Improving service. WhatsApp is now available on Android 10 mobile phones, but there are a few more bugs to be noticed.",2025-03-28 04:18:10
Blair Fyffe,1,"!! Awful Chat Transfer Experience !! ❌ Lost 10 years of chats, after trying to transfer from iPhone to Android. Must have factory reset my pixel phone 4 times trying again and again to get chats from iPhone XR to Google Pixel 9 Pro Fold. The progress bar would get to 80%, or 73% etc and close the app, all that was left was a WhatsApp pop up in notification centre saying ""Progress 80%"" All chats did not transfer over. All threads and media lost by just accepting defeat, WhatsApp NEED to fix!",2025-02-02 20:08:33
Kamal Mitra,1,"Urgent Fix Privacy: 1. Basic privacy issue for groups/communities that it is disclosing all the contacts of all the group/community numbers to other participants. Through which anyone can extract contacts. 2. No group settings is there to disable viewing of contact numbers to stop misusing of the other contacts in the same group. 3. Editing Participants of a group/broadcast list, unselect all option should be there. 4. Broadcast lists should be available to be added to the community.",2025-03-23 20:44:18
Sharmistha Banerjee,4,"Please add a ""kick participant"" feature or something that can kick someone from voice or video calls . My friend has been eating my brain for the past few months and my urge to kick her sometimes is immaculate. A lot of people like me would benefit from it. Thank you. 🙂🤍 It's been 3 years pls create this option 😭😭",2025-03-10 17:55:38
Tayoh Jordan,3,"This app is cool but the team should try to Improve on the quality of the a video when I send it to someone and I can believe that I've updated my Whatsapp and still yet, I have no Meta AI or even the other new features that have been added. I don't know what the problem is. I'll give 5 Stars when my request has been granted.",2025-03-13 11:48:34
Isiphile Gumede,4,"It would be really nice if I could upload stuff like images and documents so the AI can analyse images or pdf documents and give me feedback on that.... Also, the Avatars are nice but low-key weird now....can't pinpoint the exact problem with them, they just look strange.",2025-03-26 17:47:22
Michael Havenga,1,I have been having the worst experience with WhatsApp. One star at this point is even too good a rating for my experience. My account keeps getting flagged for spam by mistake but this has been going on since December. I have even gone to costly lengths to even change phones and numbers. This is seriously affecting my work as a lot of people contact me via WhatsApp. I have sent reviews after review asking for this to be resolved. Please can something be done about this issue as soon as possible.,2025-03-07 08:26:32
Oppong Ampofo,5,"""Great app! Smooth performance and reliable messaging,Top-notch app with seamless communication and regular updates and also Excellent experience! Fast, secure, and user-friendly, Best messaging app! Keeps getting better with every update last but not least Superb app! Easy to use and great for staying connected.""",2025-03-06 14:18:48
Chandani Kumari,1,Calling issue with whatsApp not able to receive and end the call. Camera issue not able to click photo with whatsApp camera. After 5 min I am able to see ringing when I call someone. Incoming call always vibrates but never show on whatsApp. Lots of bug with big giants. Really ashamed of this. Please try to fix it. Updates me sahi hona chaiye or aap log bigaad dete h.,2025-03-10 10:26:24
Paul Browning,1,"I really can't understand why this app has so consistently been rubbish at transferring to a new phone. It's amazing - it didn't work 18 months ago, it didn't work a year before that. Surely they must have been able to fix it in that time. The answer is they can't want to fix it. I don't know why, maybe some way of forcing you to upload everything about you and your friends to their server. If they wanted to fix this they could, would have done it years ago. They are NEVER going to fix this.",2025-03-03 01:30:27
Dhruv Dixit,4,Media file not opening when ising dual whatsapp media and also not found in Gallery.....developers plz find a solution to this...using samsung galaxy note 10 lite Hi with the latest update I found the issue while using in-app camera...sometimes it opes with a dimmed screen brightness and sometimes it shows dark screen only and says can't capture... Developers request to have a look into this,2025-03-08 11:12:28
Riaz Ahmad Hunjra,1,"Dear Whatsapp Support Team, I recently received a message starting that my Whatsapp account ( your phone number) has been banned. I am unsure about the reason behind this action, as i always strive to follow Whatsapp's Terms of Service and Community guidelines. If there has been any misunderstanding or mistake, I kindly request you to review my account and provide me with clarification. I would greatly appreciate your help in reinstating my account. Thank you for your time and support",2025-03-19 18:18:43
Ambaliu Mubarak,2,"Let's rethink WhatsApp's approach to spamming! Instead of blocking spammers, what if WhatsApp focused on improving its filtering system to allow valuable messages to get through? Spammers might actually bring valuable info or opportunities! Improved blocking, AI-powered filtering, and user feedback could help. Let's find a balance between reducing spam and allowing legitimate messages. What do you think?",2025-03-16 22:15:42
Nor Baizur Mohd Sany,5,"In is an easy-to-use and affordable device. You can block anyone you don't want to communicate with as well as anyone you don't want to communicate with. And also end-to-end encryption, which ensures that all messages, calls, photos and videos shared on the platform are secure and private. Text messaging: Allows users to exchange instant texts without SMS charges, from quick updates to long chats. Voice and video calls to anyone around the world. Group video calls allow up to eight participants.",2025-03-12 07:27:46
jay mindyah,1,"Turn off the goddamn light sensor for voice notes. It's annoying as hell, having your screen goes back because its close to your face, while listening to a voice now.. IT'S NOT ON A CALL.. ALLOW USERS TO TURN THAT FEATURE OFF. IT'S ANNOYING..",2025-03-15 04:06:01
Rahul Goel,1,Third grade app support. Extremely poor software in backup and restore system. I've got frustrated with the restoration of my chat history in my new phone and it's failing every time. WhatsApp support team is absent and only bot reply to your support asking mails. It advisable to users that we need to shift to some other messaging app which can provide proper services to its users.,2025-02-15 10:45:37
Hecate Queen,2,I used to get pop up notifications. I uninstalled and reinstalled and now it says that pop up notifications don't work with my android. Very frustrating. Now I have to periodically check for messages in my group because there is no fix apparently. Never had a problem before this a few months ago to present. Not happy about this..,2025-02-16 18:47:56
Warren Odhiambo,4,"WhatsApp is a fantastic platform for communication — fast, reliable, and easy to use. However, the video quality often gets compromised when sharing or posting on status. It would be great if WhatsApp introduced an option to maintain higher resolution for those moments that matter most. Overall, still an amazing app!",2025-03-22 19:41:42
Md Samshe,5,"This is the best messaging app with top-notch security and seamless performance. It offers fast messaging, high-quality voice/video calls, and end-to-end encryption for privacy. Group chats, media sharing, status updates, and real-time location make communication effortless. Multi-device support lets you stay connected across platforms. Channels and communities enhance engagement. With regular updates and a user-friendly design, it’s perfect for personal and professional use. Highly recommended!",2025-02-26 14:49:31
Rabail Zaheer,1,"I don't know if there's a bug or something. I can't see the blue ticks in my chat even from the past conservations of more than a year ago, AND NO, I and the person don't have their read receipts off, they can see the blue ticks in the same chat but I can't, kindly resolve the issue. It's irritating.",2025-02-28 07:21:19
D a K,2,"Wants to become default for messages, AND, haven't seen an option for editing the default contacts. Bad move to make it so difficult. Do like the video calling quality over other apps.",2025-03-07 18:07:58
Diah Ayu,2,"the new interface feels cluttered and less user-friendly compared to the previous version. Additionally, the update rollout seems inconsistent—some users receive updates much earlier than others, which feels unfair. A more balanced and timely update distribution would improve user experience. Please consider refining the design and ensuring fair update deployment for all users!",2025-03-11 11:24:04
Hiram Bolaños,1,Horrible support! I need to remove a ban on a phone number and nobody from Support will help. I always receive the same email back with instructions on how to set up an account. I respond that it does not help and I get another automated message saying I should reach out to support. HORRIBLE SUPPORT!,2025-03-17 20:19:22
Suraj Kumar,4,"If you have given the option to upload media file in high quality then why always we get worst quality when uploading status of images or video. I humble request to you make this setting useful,and update with a new features for people. Who can share images or videos in good quality. And stop us to go from mod version of whatsapp. Edit :-Writing this review after 2 years, and I finally got the solution🙏🏻",2025-02-04 15:52:16
Rayselle Rayne Nicolas Petines,1,"Lowering the rate because of terrible customer service. Somehow, there's always a bug that needs to be fixed and yet instead of prioritizing a fix for them I receive new useless features instead of actual useful stuff that can enhance my WA usage. Can't even restore backup data without going through hell.",2025-03-06 08:19:28
Kaoma Mulenga,4,"the app is great. but i only have a problem with the picture quality when sending pictures to my contacts and posting pictures on my status, like screenshots and etc.",2025-03-28 14:42:15
Happy Yadav,1,"Subject: Feedback on Recent WhatsApp Updates Dear WhatsApp Team, I hope this message finds you well. I am writing to share my concerns about recent updates, particularly regarding group creation. Yesterday, while trying to create a group for professional use, my account was banned immediately after adding a single contact. Consequently, I lost access to the group, and I am unable to add general groups to a community. These issues significantly hinder the functionality of WhatsApp for users like",2025-03-30 18:35:33
Sophie Wee,5,"I feel this app is one of the best messaging apps ever. I would suggest being able to put stickers on the home screen where you scroll through the chats, and/or being able to change the ringtone when someone calls you. Overall it's still a pretty good app and I would recommend downloading it.<3",2025-01-31 11:37:43
Kyla Mullens,3,"overall there's a lot of things to love about WhatsApp, but there's a few things that really frustrate me. I can't just search a dollar sign I have to have the exact dollar value that I'm looking for. there's another one and when I remember it I'll come back .",2025-03-29 07:59:45
Tarannum banu,1,"I've been unable to back up my chats it's asking me for a password.The backup size also keeps increasing everytime I start it anew, and it has currently reached 1.1 gb. My Google account has auto-sync turned on, whatsapp is fully updated too. The bar stays full at 100% for hours, but the backup never uploads, I never set any password for WhatsApp. I've done the recommended procedures in the app, but nothing is helping. Please look into it. I did try contacting helpline, it gives an error.",2025-02-17 20:09:49
Ankur Sharma,1,"It's so bitter experience, i can't recover by old backup all the files were corrupted once i accidently deleted ""(you)"" chat viz. saved messages, i wonder why is there 'clear chat' option, while i selected only some messages to delete.",2025-03-12 19:33:24
Trinity Makanha,5,"l like the app,l see it the best but l think it needs some little upgrading maybe we can use it to buy and download music . My other opinion is what if you allow this app to function even on poor wifi strengths because in some circumstances we're ending up downloading nothing why? because it usually stuck on pending then boom💥 *something went wrong, try again* l still like your app no matter how much it cause us thank you 😊",2025-03-23 19:47:39
Lakshay Chaturvedi,3,"Yesterday, a fraudster hacked my WhatsApp account, sent a link, and withdrew money from my credit. After that, I could use WhatsApp for some time, but then my account was marked as spam. In the evening, I contacted the help center and emailed the nodal officer. They asked me to fill out a form, and soon after, my WhatsApp was restored. However, today (07-03-2025), my account was again marked as spam, which shouldn’t have happened after the initial review. My account is still in spam marking.",2025-03-07 15:27:26
create with vanshika,5,"It is a very good app because on phone. we talk to the person who are at different places by chatting massenger app, and also it has. many options like video calling or voice calling and also block peoples that you don't want to communicate 👍",2025-03-27 11:09:29
Joshua Khan,5,Amazing app for social attraction and to connect with family and love ones . But there should be reels in WhatsApp so that we don't have to use tiktok or Instagram for entertainment and can have fun in WhatsApp. It's an awesome and interesting idea if the developers add reels option in WhatsApp.,2025-03-11 12:22:00
Zzz,1,"(Also unable to select many stickersatonce) Whenever I clear chats AND select the 'also delete media of this chat from gallery', the media just does not go away. I just can't see the chats and the media in that particular chat BUT it's still there in the app data (the chat shows GBs worth of data in the storage) AND on top of that, every single photo and video of that chat is still there in my gallery. I used to clear chats to get rid of the storage problem in one go but it's of no use now. Help",2025-02-15 22:11:58
ilodigwe tochukwu,4,I just recently updated the new version of WhatsApp and it keeps telling me Whatsapp isn't responding I tried entering other apps and they are working perfectly..even switched off my phone and on back and still giving that Whatsapp has stopped vibes whereas other apps are working fine.,2025-03-19 19:12:31
Warrex Phakathi,5,Really loving everything and satisfied by the way it functions. The new upgrade that allows one to add music on your status is just amazing adding to the app's perfection in all sense!!!!!,2025-03-30 19:00:50
reuben syer,2,"Whatsapp on Honor x6a saves audios to /whatsapp (the old location that was used before android 11) and not /com.whatsapp which means it doesnt show up on my music player app and I have to move every single audio that I want to send to people etc to a new com/whatsapp folder that I created every time, or I have to forward the music file to myself on gmail to download it to easily use it normally... PLEASE. I'm out of hope and this is so inefficient.",2025-03-01 15:19:28
Alaa Buhussaien,2,"Hello, There is big bug with the chat themes in WhatsApp app (Android version only), The 🎤 microphone color not changed When you changed the themes colors. When the ""Read receipts"" is ON/enabled. The microphone icon should be not white before listening to voice messages (should be silver then white after listening) In WA on iOS not having this bug (Only on Android) white always (even when read receipts on or off) in both white. This should be fixed when it's on. Please fix this bug on Android.",2025-03-03 04:17:37
Young Joker,5,"WhatsApp have always been most people favourite, even people reviewing it as bad are still using it, WhatsApp is the best chatting app me and you can tell, and the new status way is good, adding music to status is good but we need more updates too, like features to hide your number from everyone and all that and also who can message you",2025-03-19 09:58:18
Khan Farhan,1,"This app is very worst, because when I post a status on it, It gets blurred little much. And not clear as like 1080p.. I exported my edited video in 1080p and in 50 FPS, but still now it is showing blurred on my device and on another's device also. I regardly say this to whatsapp community to improve this bug and glitche.",2025-03-08 19:29:28
Akinteye Oluwajuwonlo,1,"I'm tired. Updates keep coming and keep spoiling this app . This app used to be good before. How can I set my photo a d video quality to HD and when I send or post one, WhatsApp destroys the quality 🤦i don't even understand anymore. I've tried all I could yet I can't send a video or picture in HD without WhatsApp destroying the quality to 144p where you can literally see the pixels🤦 Time to leave this app and switch to something better.",2025-02-26 11:07:49
Mounika Maddala,5,"WhatsApp is a widely used messaging application that offers a range of features, including text messaging, voice and video calls, group chats, and media sharing. Its user-friendly interface and cross-platform compatibility have contributed to its global popularity. Pros: Ease of Use: Users appreciate WhatsApp's intuitive design, making it simple to navigate and communicate. Feature-Rich: The app supports instant messaging, photo and video sharing, group chats, and reliable voice and video ca",2025-03-28 09:51:54
Kabo Molefe,2,"Honestly I really liked this app but recently it has given me problems. It would log me out and ask me to write a review so I did but then my account is still logged out for a whole day. At times I'd have important things i need to get on this app. After it checks my review it would be like"" we accidentally flagged your account"" but they'd still long a day two after they "" accidentally flag my account"" I got bored of it, so now I had to create a new account which is also a lotta admin.",2025-03-18 06:18:19
Vic Phantom,1,EVER SINCE THE UPDATE this app keeps getting forced close!! it's so annoying bc everytime i type something it got forced close so i had to type it whole over again!!! and i did reinstall the app and the result stays the same 😤,2025-03-09 11:52:26
Harendra Kumar,3,"I am describing about WhatsApp. It's a very good app but from a last few days, it is giving some lacks, like when I view to WhatsApp status of my contacts, it doesn't show them in a correct way. The upper and lower part is covered with the behind background of whatsapp and then it shows the status. And second I'm unable to share videos in file format such of about 500 to 700 mb. Overall it's good except of such these malfunctions.",2025-02-26 04:43:03
Muhammad Nasir,5,"Lately, the app features are really helpful and amazing but I still don't know why my music icon is not reflecting on my status.. I'd love if they would make it available or fix this issue please. Thank you",2025-03-12 19:24:13
Huzaifa Malik,2,"Hey there I am using on whatsapp web from a long time but from last week my whastsapp on web is not opening , , even I scanned the barcode correctly and even with phone number , I don't know why , I think my number is having an issue globally after having a long ""loading chats"" screen it says on the url , logout reason1&reason2 , can you please tell me what is happening with my account , I have to do a lot of work on my web screen so please clear everything as soon as you can , I am mentioning b",2025-03-17 19:03:20
kalajipreetha subhadra,3,It is good for sending and receiving massages easy. Communication is easy by hand. Easy to operate as the person desires. Good for group communication. Positively this application is very informative from our day to day office work with communication and useful our personal messages given.,2025-03-15 05:17:06
dorina Josiah,5,"Downloading this app is a very big problem, this is the second day, after encountering reading new message a big problem, i decided to delete the older version because they insist on updating,i updated and it denied.please help customer to have communication as the service provider. Thanks",2025-03-05 09:48:22
Rethabile Tsoaeli,5,"The app is great no complaints. But could you please add a feature where we can search or filter conversation by the dates? Example , we search a certain date and it gives us conversations of that day.",2025-03-18 21:08:23
salman hossain,1,"This feature of yours is a bad chat lock at once. I fixed it but when I removed it, all my previous conversations, files, photos were gone.This is very difficult for me,😭 The conversations I had with him were all gone in time. I will never forgive you 😭 Please remove this feature. as early as possible",2025-03-17 16:46:22
Jass Brar,1,"WhatsApp new update is very bad because it is written end-to-end encrypted on the status and it is not known who has seen the status. Only the people who like the status get it shown and the people who don't like it or see the status, their name is not shown. Please fix this. #Whatsapp",2025-03-11 11:45:46
Mzamo Jili,3,"I am facing a problem when trying to send audio and also video call picture isn't clear sometimes and voice often breaks and can't hear the other part clearly. Please just improve vedio cal network status and if possible, please add some settings to enable us to do self service. Instead of going to help center...",2025-02-23 11:23:08
Hamed Alokozay,5,"Since March 27, 2025, I have had issues with voice recording on WhatsApp. When the timer counts seconds, it works fine, but when ""Recording"" appears on the screen, it stops and cuts the audio. my phone model is Redmi note 11.",2025-03-29 08:22:03
Ismail Von Schaeffer,3,I'm not sure what the problem is or whether it's the app or android magic os version but when my honor 90 is on silent with vibration what's app remains on silent without vibration having me miss calls all the time. The notification settings are all setup correctly but still it does not vibrate. Tried all troubleshooting tasks but still remains the same. Please help,2025-02-25 05:13:34
Pavankumar Vempada,5,"I have an idea , i think i will be use full that is : for example if tell my friend to do some thing he replies me with an emoji. ""👍"" Not a message type one but it is if tap a message for some time it shows you to select an emoji , i am telling this type of replies not a message type kk , that emoji reply should show the time to me when he replied kk this is my feedback . I think you might see this reply me .",2025-03-14 06:52:25
Hercules,5,Best for international communication Connecting with people across the globe is easier than ever. Sharing experiences and ideas enriches our understanding of different cultures. Clear and respectful communication bridges geographical distances. Building relationships internationally fosters collaboration and innovation. Let's embrace the power of global communication to create a more connected world.,2025-03-12 20:53:29
KESHAV KUMAR,1,I don't think that this is a good app for chatting or calling because it has so much but and half of my phones emoji does not show and it really annoy me but to be honest it is great but when Message my friends they say they didn't receive message but In my whatsapp it shows the message is delivered and in the call the sound is so glitchy and my friend says I am faking it and they don't talk to me now because they think I ignore them but no one believes that my whatsapp has a annoying glitch😖😞,2025-03-18 08:25:26
