User Name,Rating,Content,Date
Srijan Panicker,1,"I really don't like the newer version of whatsapp, it was so good back then! It's almost impossible to share videos to anyone! Only 25 mb video but shows 10 hours to go, I have to try multiple times then it rarely goes, I don't know what's the matter, my network is good, every other platform works great, but this has so much issues!",2025-03-05 18:15:08
Rob Schipper,1,"Again WhatsApps is not working, message get stuck at the server again, calls are not going through. This seems to be normal now with WhatsApp. Now something new, WhatsApp seems to have lost chronological sequence. New messages both incoming and outgoing appear at random places in chat. Messages that i send today appeared in yesterday and last week timeline.",2025-03-05 09:51:50
Anita Jonathan,4,"Well it's really good,new features are been added almost every day and they are cool... But am trying this new feature ,on how to transcribe voice messages (voice note),but it's not working.... though now am updating it to see if it's works... But apart from that it's a really good app...",2025-02-26 09:10:12
Saqib Ali,5,"Simple. Reliable. Private. WhatsApp from Meta is a FREE messaging and video calling app. It’s used by over 2B people in more than 180 countries. It’s simple, reliable, and private, so you can easily keep in touch with your friends and family. WhatsApp works across mobile and desktop even on slow connections, with no subscription fees*. Private messaging across the world Your personal messages and calls to friends and family are end-to-end encrypted. No one outside of your chats, not even What••",2025-03-15 07:29:14
Neill G.,1,"Used WhatsApp since the early days as it felt unadulterated. Now however with meta's AI update I feel it's becoming just another extention of the hated facebook. Added to which I don't seem to have the ability to opt out or switch off the floating icon or ""search"". If only my family would listen and move to a safer actually secure chat app.",2025-03-29 17:32:12
Zion Desai,1,"Worst app, each time it asks for an update, it requires of me to uninstall it, loose all the data & then gets to working. Such an idiotic version. & now that I've given a bad review, it started to download. Such an idiotic app! Hate this app for real now, takes more than 30 mins to install, tho it's nothing wrong with my connection speed. WORST APP EVER!!",2025-03-12 15:43:06
Ростислав,1,"My phone broke. And the service center reinstalled the operating system. After I picked up the phone from the service center, I had to reinstall all the programs, including WhatsApp. All the chats disappeared except for one. After I contacted the support service, they wrote to me that they do not provide support for such issues.",2025-01-31 20:50:13
Yasin Arain,5,Excellent.. but I want to suggest one thing more now WhatsApp is very updated and amazing but you also add one thing to set music on videos.like if you send a video to someone but your didn't send this song you can change it at a time and send the video.. thanks 🙂. Wow amazing!! I am just surprised when I see the option of song changing it's really amazing.. WhatsApp can process very fast.I am very happy to see that.,2025-03-16 03:22:02
Nisha Nanthini,4,"I've been facing an ongoing app lock issue for the past few weeks. I am unable to open the app with the app lock the first time; I can only access it on the second attempt. It's really frustrating to have to unlock WhatsApp every time. This issue has been consistent, and I would appreciate a quick resolution. Other functionalities is working good.",2025-03-04 11:04:45
Vincent Kay,1,"Received a message from one of my accounts but said can't switch when I tapped on it, went in app but couldn't find the switch account option. Tried restarting device and updating app. Decided to add lost account only to lose every single chat. Years worth of messages, kind of devastating. Effective but unnecessarily aggressive way of making me regret not backing up my account data, how pitiful.",2025-01-27 15:40:14
Jijo Francis,2,"Had an issue while transferring chats to new phone. Had created a google backup (28gb). During transfer, the qr code mode was unsuccessful. On restoring with the google backup, 28gb got downloaded. Media appeared in the gallery. But none of the chats restored despite multiple attempts and following troubleshooting steps. The support team wasn't helpful either. Otherwise, I have had a good experience with the app. But this loss of data is of significance.",2025-01-27 08:36:56
Tejaswini Nayak,5,"It's the Best app.... 🤩 But when my friends are having an upgraded version of whatsApp, I don't have it... For example, My friends had Meta AI 2-3 months ago, I am having it now... That's only the Bad thing about this app but every thing else is very good..... Please don't ignore it, I am getting problems....",2025-03-30 09:07:22
David Jarrett,1,"~~~~Use Signal instead~~~~ trying to get my contacts to use Signal instead as WhatsApp shares your contact info (including phone numbers), IP addresses and your phone info with the rest of Meta's companies (including Facebook) + sells your data to other companies.bl Note that Signal doesn't - it fully encrypts your data from your device to the people you are messaging. can't turn off or otherwise get rid of Meta's AI.",2025-03-29 14:09:04
J S,3,"It's a great way to stay in touch with coworkers, etc. I like the fact that you can mute notifications. However, it would be nice if one could choose the amount of time to mute notifications. The only options are 8 hours, 1 week, and all time. Sometimes, you want to mute for longer than 8 hours and less time than 1 week",2025-03-29 21:45:59
Aly B,1,"The new update is awful. I don't want to have random 'channels' forced down my throat. This is a messaging app, not social media, I use it to contact people I know. Let me opt out of the rec channels, I'm not gonna use it and REMOVE META AI! Make it a toggle, I don't need AI for a messaging app!",2025-03-28 19:02:48
Jayalaxmi G,1,"once the caption for status photos are updated it is not possible to edit it back. either we should repost it or delete the post. While settings up status privacy, if we select Pass mark of the right most upper corner option, all contacts will be excluded immediately. Not even a confirmation popup will appear. We should take a pain of again including and excluding the contacts to show our status activities. Pls keep one popup before we set a status privacy, in your next update.",2025-03-29 04:18:53
HONOUR LOGAN,1,"While I understand the intention behind mentioning group members when posting a status, I believe it has made being part of groups less enjoyable. As a user, I find it overwhelming to be mentioned every time someone posts a status, and I'm sure I'm not alone in this sentiment. I would appreciate it if you could consider providing an option to opt-out of these mentions or make them less intrusive.",2025-03-30 09:46:43
Daniel Kioko,1,"I've been experiencing ongoing issues with WhatsApp where the app keeps stopping unexpectedly. Despite updating to the latest version, the problem persists. Every few hours or days, the app crashes and refuses to open, forcing me to uninstall and reinstall just to use it again. Even after reinstalling, the issue eventually returns. This is incredibly frustrating, especially since WhatsApp is a crucial communication tool. I’ve tried clearing the cache, restarting my phone.",2025-02-27 11:49:20
Sneha Biswas,5,This app is too good for communication with others but include song adding feature in it like insta or fb I'm glad that you added those features but I was quite happy with the old archive features where we have to open the archive section to read messages from archived contacts or groups it's annoying when they keep showing those messages in the main message section,2025-03-29 04:19:38
Luka Milenkovic,1,"I don't need to be forced to have ""AI"" pop up everywhere in my messaging app. That is literally the one and only use of WhatsApp, to communicate with other HUMANS over the internet. The fact that it cannot be disabled, is a true crime here. When I contacted support about it, I received an automated response, saying that they cannot yet accept ""AI related"" support tickets and I should use the FAQ, which is useless, only states a hundred different ways to use the AI, that I don't need or want!",2025-03-29 10:06:46
Inderjith Roy,5,Recent change made it very great that is addition of song with status . Thank you whatsapp for it . Now i want one more thing if it is possible then plzzz do this that do some arrangement so that we can add songs that is stored in my file or phone . i am very happy and will be more happy if you add the mentioned feature .,2025-03-30 18:13:03
Malik Tamboli,1,"I enjoy using WhatsApp, but I’ve noticed a significant issue when uploading video stories. The video quality is drastically reduced after uploading, with a noticeable drop in bitrate. This makes the visuals look much poorer than the original. I understand there may be compression for faster uploads and reduced file size, but the current quality loss is too much. It would be great if WhatsApp provided an option for better quality uploads, even if it takes slightly more data.",2025-02-08 12:50:04
manjula unny e,5,"I am so happy . please you need to include one more feature. which is hiding personal details like profile pic, online status, read message off/on, status,call blocking such things for specific person. now the option is for everyone or group but still not all these which I mentioned above. it should be available in each and individual chat option and also in group chat option..",2025-03-28 05:35:06
Paula L,1,"I'm not interested in ""ask Meta AI anything"". I ignore if most of people are happy with this feature but I personally just need a normal and functional messaging app. Nothing more. Most likely I will be uninstalling, the contacts that are important to me I can reach through a different app anyway.",2025-03-29 15:13:02
Buhle Bendalo,1,"my WhatsApp calls automatically silence themselves. my phone is not on do not disturb, I switched off the ""silence unknown numbers"", the notification are all on, my phone is on loud, but then I received a call and it said it was on silent mode while it was never on silent mode. why ???? I've tried all that you'v just mentioned, everything is on, but then the WhatsApp calls automatically silence itself. I don't know how many times I reset WhatsApp, I don't know how many times I factory reset my",2025-03-30 06:46:03
William Moore,5,"This app is great if you have a smart phone like TracFone instead of using your phone minuets for making regular calls you can use this app calling someone local, long distance, and into another country and not get charged a penny long as you use the app tell friends and family to get it as well",2025-03-29 19:54:46
Enggar Fathia,1,"I try to move from iphone to samsung, bu the initialization always unable to connect. I try it many times and now my account get blocked for 24 hours. I email to you many times but I cannot get the solution at all. It's the worst chatting app ever.",2025-03-26 04:36:11
David Teixeira-Lynch,1,"I need the option to switch off Meta AI. I do not want nor need AI features so need an option to disable this. Also need a ""spoiler"" option for sending messages to contacts without spoiling the content for them. Other messaging apps have this.",2025-03-30 12:12:52
Mia,2,"MetaAI was not asked for in this app and it is not necessary, it feels like a complete breach of privacy and is makinge hesitant to use the app. Overall messaging is good but I'm slowly thinking of deleting this app because of updates trying to be like other social media apps. WhatsApp is a messaging service so it doesn't need a built in chat bot. I feel worried about what data the AI has been trained on and I do not believe the disclaimer one bit as other apps say similar things which were fake",2025-03-30 09:47:13
Ayesha Naimat,4,"Please also add ""HD quality and Standard quality"" options in uploading of profile picture so that the quality of the profile picture is not compromised like those in sending photos!!...Whenever I upload the profile picture it appears so blurred!!!!!!!... Kindly focus on this!! (Users of WhatsApp should also be given the option of choosing the quality of profile pictures whether it is HD or Standard quality)",2025-03-28 23:53:28
Chris Davis,1,Latest update has rendered the app useless. It crashes every time I try to open a specific chat. I have tried clearing the cache and uninstalling and restoring from a back up but the problem persists. Very poor,2025-03-30 15:30:03
Bright Alexander,1,"Since updating my WhatsApp on 25th March, 2025, I can't send videos... it always says, 'file format not supported. choose a different video ' And I can't even send a recorded WhatsApp video too 😔... pls fix this bug ASAP. THANK YOU!",2025-03-30 05:50:47
Machetti Madhusri,1,"My whatsapp app is closing automatically while I'm using it and most of the time I don't get any notifications (for calls and messages) even when the wifi or the mobile data is ON. I've uninstalled and reinstalled whatsapp several times, but the same issue persists. Plz help...",2025-03-27 16:40:11
Vladimira Dermendjieva,1,"I woke up this morning to Meta AI having added itself to my app without my consent, in the form of an unsolicited chat and a button on my Chats screen. I do not want any AI whatsoever coming anywhere near my personal chats and I consider this a violation of my privacy and right to consent! I have searched all settings and there is no way to disable AI. When I raised a ticket I received a message saying no help is available for AI and that replies to my message won’t be read. This is not okay!!!!",2025-03-28 09:26:22
Émile,1,"Keep the AI slop out of this app, or at least make it so that it can be disabled. If I want to talk to a chat bot I'll install a chat bot app, but please don't force this trash into my mouth even in an app that has absolutely nothing to do with it. I'm gonna start an active campaign to switch my family's group to Signal, wish me luck.",2025-03-29 09:18:06
JAYLO “Jha Jha”,5,"WhatsApp is easily use it that allows users to send text messages, voice messages, make voice and video calls, share images, videos, documents, and more, over the internet. It also supports group chats, status updates, and has been widely used around the world as a primary communication tool for personal and business purposes.",2025-03-28 10:41:16
Muhammad,4,"Hi here are a few suggestions you can consider for future updates. Do consider adding customisation for downloading media. The current version is good where it can download specifically what media for mobile data and wifi. However it would be great if each individual chat would have the customisation as well. Where contact i choose to download all media photos and videos, while contact be i only opted for photos only. please consider this. thankyou.",2025-03-08 16:56:09
Keith Cardoz,3,Recent update changed the gif provider from Tenor to Giphy on my device. All my friends and colleagues still have Tenor as their gif provider even after updating. Giphy has extremely limited content. I had to downgrade to an older apk version to get tenor back. Fix this or add an option to choose the gif provider. Will refrain from updating the app till this is fixed.,2025-03-28 19:32:33
MrT Art,1,"After updating the app i was locked out out of my chats with the mgs ""this account can no longer use whatsapp due to spam"" I'd only recently started using this app to communicate with family&friends now i have to wait 24hrs for a review. Completely sad After 24hrs and originally making this review my account was restored/now the app is stuck on the ""initializing... "" screen with the continuous prompt unable to connect but when i click ""check status "" it was whatsapp service is running 😔",2025-03-29 07:30:42
Elyse Antosh,1,"I usually never even write reviews, but my first 5 minutes on this app simply baffled me. As soon as I created my account, I sent messages to my two friends and instantly got flagged for spam. I have no idea how ""Heya buster, its me"" is suspicious activity, but I am extremely disappointed. I sent an appeal, but from my past experiences, support usually ignores it.",2025-03-27 22:55:08
K K,2,Chanel is a pain ..pls add diffrnt tab for chanels don't mix it with status..it's very frustrating. or atleast add settings those who don't need can skip it or may not use that feature..it's seriously frustrating as it disturbs status view.,2025-03-30 16:55:17
Bonface Wachira,3,Should enable having the same account in two phones at the same time. For when a user may need such a scenario. Also forcing updates on the user is awful especially when the app becomes unusable because it is unupdated.,2025-03-28 21:11:53
Grace,1,- i repeatedly failed to back up & lost datas even though i have more than enough storage. it keeps saying i need to free up my internal storage while the free space is almost 3 times larger than my whatsapp data. - unable to send videos even tho the size is <15MB and in common format (MP4).,2025-03-29 17:37:35
Daniela Iacono,1,"the app stops 2 of my chats and are unable to chat to them. uninstalled already and the support didn't fix the issue. very bad experience after many years using the app. this is the third time installing the app back and the bug is still here. and the worst, No support, at all",2025-03-30 18:23:55
Richard,1,Meta AI is annoying and I do not want it especially the silly blue circle. it failed 5 times when I asked how to remove the app. by chance I got there on my own. then the blue circle is still on my whatsapp. I ask how to remove it and it gives me again instructions that do not work. like hold on the message and toggle Meta Ai on / off. With this bad experience and still stuck with the blue circle I would NOT TRUST any answers. Google gives you the OPTION to use CoPilot/Chat Gpt. why not META!!,2025-03-29 13:06:41
Chris Vanilla,1,Get the AI floating icon off my phone! The latest update March 2025 had a floating AI icon you can't turn off! I don't mind AI if it's a discrete option: I do not want it rammed down my throat! Allow users to remove the icon. You have to install an older version of WhatsApp if you don't want their AI which means taking chances with security and installing outside of the Google Play store and switching off updates. Switch off updates now!,2025-03-30 11:13:10
Dheeraj Sen,1,"I've been experiencing an issue with WhatsApp status where the images appear blurry even after they are fully downloaded. Despite having a good internet connection and ensuring that the original image quality is high, the status still looks unclear and pixelated. This problem persists regardless of whether I upload the image myself or view someone else's status. It affects the overall experience, making it difficult to appreciate photos or read text properly. WhatsApp should address this issue.",2025-03-18 16:28:49
Chandra Mohana Prasad V,4,"A calling person don't know if called party's Data/WiFi switched On. The ring goes on but no answer from other end. Call Recording should be there because so much fraud is going on through WhatsApp. Facility to select lines and copy from Message should be possible, instead of the whole message.",2025-03-26 18:25:21
Adrita,3,chat lock with secret codes often don't work and it is irritating. secret code gets no chats unlocked sometimes! also the filter in video calls is not updated in mine...don't know why this happens even after updating the app regularly.,2025-03-28 07:46:53
Tabakee Q,1,"Since last night, whatsapp forces a completely unnecessary stupid AI feature onto the user (EU). With a big eyesore of a button above the ""new message"" button, which you can not deactivate or opt out of. I don't want stupid ai in my messanger app. I don't need stupid ai to chat with my REAL HUMAN FRIENDS. Get lost! I'm downloading Signal now. Meta sucks. Not everything needs AI. Literally no reason to have this in the human-to-human messanger app.",2025-03-29 11:12:03
Gareth,1,"Disgusting that you're forcing AI nonsense on us now without any option to disable it. I don't want it, and no, I don't believe you're not scraping all of our conversations, whether we interact with it or not. I'll be encouraging my friends to use any other messaging app.",2025-03-29 23:05:13
Sai Manoj Rao,1,"I am facing this problem frequently, ""This account can no longer use WhatsApp due to spam"". Also unwanted communities without my permission making me join. Day by day this app getting worse. Previously, it was not like this, but nowadays don't know what happens. This problem ""This account can no longer use WhatsApp due to spam"" occured second time, I want to be my account to be recovered. As soon as possible.",2025-03-27 18:27:27
S. Abu,1,"Very helpful and useful app. Unfortunately, every day even sending a few messages to one friend (without political, religious or any violated topic) my account is blocked. After sending a request for review, the AC was restored on the next day only. May be some software bug. But WhatsApp will never give the exact reason for the block. The public has no clue why and for which exact reason the account is blocked. Only the reply says ""you have violated the terms"" and asked me to read and post.",2025-03-29 02:50:18
John Grennan,1,"Uninvited AI features turning a simple messaging app into a cluttered experiment. It’s starting to echo a certain era of ‘greatness’ — bloated, blustering, and blissfully unaware of what users actually want.",2025-03-29 01:21:52
Harsha Nair,5,"Thank you WhatsApp for providing the amazing feature of adding music to WhatsApp status. We've been waiting for this music feature for a long time, so you've done a great job by providing this excellent music facility",2025-03-29 17:15:51
ÑIKHIL KUMAR PANDA,4,"All Features of WhatsApp are just wonderful & in my point of view features are also easy to use.. But with disregard I want to point out that the message editing feature have some negative points for those person who are little bit impatient,they suddenly start questioning that ""what you have just edited now"". So my request to WhatsApp developer that allow both sender and receiver to see the edited part & unedited part too. Thanks for your support ☺️",2025-02-07 13:28:16
Rajesh Jaiswal,1,"Very very hopeless software. When you are reading any message and mistakenly your finger presses Mic button, then immediately it starts audio recording and it gets sent !! Such dangerous bug exists in this software since many years !! Meta's engineers are stupid and lazy that's why they aren't able to solve this bug!! Chinese engineers have already developed an app better than WhatsApp !! We are just waiting for its launch all over the world !!",2025-03-09 20:55:39
Prasun Dutta,1,"My phone had got stuck in a bootloop, and I had to go to the Service Center in order to repair it. I got my power button changed, and installed a new battery. However, since then, my WhatsApp Account has been ""blocked due to spam"". I've tried umpteen times to submit a review. WhatsApp keeps on flashing the message ""Something went wrong while submitting. Please try again."" Whether or not my account will be restored is a different matter, but WhatsApp should at least accept the review! PATHETIC!!!",2025-03-12 17:22:24
Premanshu Das,4,"It is great to see the music feature being added to the app. Now, if the stories (WhatsApp Status) can have original quality uploads and videos longer than one minute, it would be great. Also, a 5-10 second video as a profile video instead of just profile pictures could be a great addition too.",2025-03-27 15:51:15
Ghanshyam Bajpai,1,"Although this application is much good, but now they are creating too many distractions i.e. song in status and etc. I hope there is no need to create this types distractions like instagram. I hope you will not create any distractions further now as like instagram.",2025-03-29 13:08:12
Pika,3,"very good app! but please let us screenshot people's profile pictures again, some people screenshot it when they want to make a video or just keep it as a memory(especially when matching a profile picture with someone)",2025-03-30 17:42:55
Damilola Akinwumi-Oke,3,"Your updates are too much too unnecessary sometimes and you only focus on updating the phone version. What happened to the laptop WhatsApp version? That hasn't been updated in a while. There are no ""Favorites"" section on there. Or even lists. Do better. Also, would it be too worrisome to y'all to increase the number of chats that can be pinned??? 3 is just too 2019. Update that. Very necessary.",2025-02-26 11:48:48
Dhar Ma,1,"I've been happy enough with WhatsApp for years until AI has been forced into it. There is absolutely no need to have AI in WhatsApp, and the fact that they don't provide you with an option to disable their AI says it all. I won't be using it anymore. If Meta wants to force stupid, pointless features on their users, I don't don't want to be their user.",2025-03-30 07:40:28
HaSan AkAy,1,"I am giving one Star to draw attention of developers to an important #BUG .. When you compose a message and then try to attach a picture or document, it immediately sends your attachment BUT your message has disappeared ! No way to bring back all your work. So first you have to send your message and then attach whatever. This problem should be immediately addressed. Thank you.",2025-01-20 13:23:52
